{
  "author": [
    "WatchMyAI contributors"
  ],
  "description": "Detects ai file modification outside approved workspace from underlying WatchMyAI request, decision, approval, resource, capability, and execution evidence without producer-declared findings.",
  "enabled": false,
  "false_positives": [
    "An outdated allowlist, workspace root, adapter capability declaration, or operator-approved administrative workflow can resemble the condition."
  ],
  "from": "now-6m",
  "index": [
    "logs-watchmyai.events-*"
  ],
  "interval": "1m",
  "language": "kuery",
  "license": "Apache-2.0",
  "max_signals": 100,
  "name": "AI File Modification Outside Approved Workspace",
  "note": "## Expected alert\n\nOne deduplicated critical alert for AI File Modification Outside Approved Workspace with action, session, policy, guarantee, and chain evidence.\n\n## Investigation\n\n1. Verify event-chain continuity and adapter capability.\n2. Review request, decision, approval, and execution records sharing the action ID.\n3. Confirm the active signed policy bundle and resource classification.\n4. Contain the session when execution followed DENY or approval integrity failed.\n\n## Limitations\n\n- Cooperative hooks do not provide kernel-level containment.\n- Hosted or direct tool paths outside declared adapter coverage can require endpoint evidence.\n- Isolated-lab alert evidence for this rule is documented separately; tune the rule to the false-positive profile of each environment.",
  "query": "event.dataset:\"watchmyai.events\" and event.action:\"policy_violation\" and watchmyai.policy.violation.type:(\"execution_outside_approved_workspace\" or \"path_scope\") and watchmyai.tool.category:\"file\"",
  "references": [
    "../telemetry-gateway/docs/TELEMETRY_SCHEMA.md",
    "../telemetry-gateway/docs/ARCHITECTURE.md"
  ],
  "risk_score": 91,
  "rule_id": "WMAI-002",
  "rule_source": {
    "type": "internal"
  },
  "severity": "critical",
  "tags": [
    "AI Agent",
    "Workspace Control",
    "Maturity: testable",
    "Custom telemetry: true",
    "WatchMyAI",
    "schema-1.1.0",
    "remediated-2026-07-20"
  ],
  "to": "now",
  "type": "query",
  "version": 2
}
