{
  "author": [
    "WatchMyAI contributors"
  ],
  "description": "Detects common package-manager installation commands launched directly by a supported CLI AI agent.",
  "enabled": false,
  "false_positives": [
    "Approved maintenance or controlled laboratory activity can resemble package installation anomaly."
  ],
  "from": "now-6m",
  "index": [
    "logs-endpoint.events.process-*",
    "logs-windows.sysmon_operational-*",
    "winlogbeat-*"
  ],
  "interval": "5m",
  "language": "kuery",
  "license": "Apache-2.0",
  "max_signals": 100,
  "name": "Package installation anomaly",
  "note": "## Expected alert\n\nOne high-severity alert for Package installation anomaly, preserving the fields declared by this rule.\n\n## Investigation\n\n1. Confirm the originating AI task, human owner and relevant policy version.\n2. Inspect the source event, process ancestry and affected resource evidence.\n3. Validate approvals and determine whether the observed action was authorized.\n4. Preserve timestamps and stable correlation identifiers before containment.\n\n## Limitations\n\n- Immediate-parent attribution can miss shell grandchildren and must be confirmed for each agent version.\n- Confirm AI intent, approval, and task scope with the correlated WatchMyAI session evidence.",
  "query": "event.category:process and event.type:start and process.parent.name:(aider or aider.exe or claude or claude.exe or codex or codex.exe or copilot or copilot.exe or gemini or gemini.exe) and process.name:(apt or apt-get or brew or choco.exe or dnf or npm or npm.cmd or pip or pip3 or pnpm or winget.exe or yarn or yum) and process.command_line:(\"* add *\" or \"* i *\" or \"* install *\")",
  "references": [
    "docs/WatchMyAI_Detection_Engineering_Handbook.docx#WMAI-062",
    "https://www.elastic.co/docs/reference/ecs"
  ],
  "risk_score": 73,
  "rule_id": "WMAI-062",
  "rule_source": {
    "type": "internal"
  },
  "severity": "high",
  "tags": [
    "WatchMyAI",
    "AI Agent",
    "CLI Agent",
    "Maturity: validated",
    "Custom telemetry: false",
    "Endpoint building block"
  ],
  "to": "now",
  "type": "query",
  "version": 1
}
