{
  "author": [
    "WatchMyAI contributors"
  ],
  "description": "Detects at least 50 file changes by one process entity during a rule execution window.",
  "enabled": false,
  "false_positives": [
    "Approved maintenance or controlled laboratory activity can resemble bulk file modification."
  ],
  "from": "now-6m",
  "index": [
    "logs-endpoint.events.file-*",
    "logs-windows.sysmon_operational-*"
  ],
  "interval": "5m",
  "language": "kuery",
  "license": "Apache-2.0",
  "max_signals": 100,
  "name": "Bulk File Modification",
  "note": "## Expected alert\n\nOne medium-severity alert for Bulk File Modification, preserving the fields declared by this rule.\n\n## Investigation\n\n1. Confirm the originating AI task, human owner and relevant policy version.\n2. Inspect the source event, process ancestry and affected resource evidence.\n3. Validate approvals and determine whether the observed action was authorized.\n4. Preserve timestamps and stable correlation identifiers before containment.\n\n## Limitations\n\n- The default threshold is a lab starting point and does not prove that the files belong to an AI task.\n- Endpoint telemetry identifies observable behavior but does not prove AI intent, approval, or task scope.",
  "query": "event.category:file and event.type:(change or creation)",
  "references": [
    "../docs/DETECTION_RULES.md",
    "https://www.elastic.co/docs/reference/ecs"
  ],
  "risk_score": 47,
  "rule_id": "WMAI-023",
  "rule_source": {
    "type": "internal"
  },
  "severity": "medium",
  "tags": [
    "WatchMyAI",
    "AI Agent",
    "Filesystem",
    "Maturity: validated",
    "Custom telemetry: false",
    "Endpoint building block"
  ],
  "threshold": {
    "field": [
      "process.entity_id"
    ],
    "value": 50
  },
  "to": "now",
  "type": "threshold",
  "version": 1
}
