{
  "author": [
    "WatchMyAI contributors"
  ],
  "description": "Detects selected secret-discovery search patterns started by a supported CLI AI parent.",
  "enabled": false,
  "false_positives": [
    "Approved maintenance or controlled laboratory activity can resemble secrets discovery activity."
  ],
  "from": "now-6m",
  "index": [
    "logs-endpoint.events.process-*",
    "logs-windows.sysmon_operational-*",
    "winlogbeat-*"
  ],
  "interval": "5m",
  "language": "kuery",
  "license": "Apache-2.0",
  "max_signals": 100,
  "name": "Secrets discovery activity",
  "note": "## Expected alert\n\nOne medium-severity alert for Secrets discovery activity, preserving the fields declared by this rule.\n\n## Investigation\n\n1. Confirm the originating AI task, human owner and relevant policy version.\n2. Inspect the source event, process ancestry and affected resource evidence.\n3. Validate approvals and determine whether the observed action was authorized.\n4. Preserve timestamps and stable correlation identifiers before containment.\n\n## Limitations\n\n- Keyword searches are noisy and miss custom secret names or direct file API access.\n- Confirm AI intent, approval, and task scope with the correlated WatchMyAI session evidence.",
  "query": "event.category:process and event.type:start and process.parent.name:(aider or aider.exe or claude or claude.exe or codex or codex.exe or copilot or copilot.exe or gemini or gemini.exe) and process.name:(grep or rg or find or findstr.exe or powershell.exe or pwsh.exe) and process.command_line:(\"*password*\" or \"*secret*\" or \"*token*\" or \"*api_key*\" or \"*.env*\" or \"*.ssh/id_*\")",
  "references": [
    "docs/WatchMyAI_Detection_Engineering_Handbook.docx#WMAI-073",
    "https://www.elastic.co/docs/reference/ecs"
  ],
  "risk_score": 47,
  "rule_id": "WMAI-073",
  "rule_source": {
    "type": "internal"
  },
  "severity": "medium",
  "tags": [
    "WatchMyAI",
    "AI Agent",
    "CLI Agent",
    "Maturity: validated",
    "Custom telemetry: false",
    "Endpoint building block"
  ],
  "to": "now",
  "type": "query",
  "version": 1
}
