{
  "author": [
    "WatchMyAI contributors"
  ],
  "description": "Correlates discovery, transfer-tool and shell execution launched by one parent process within five minutes.",
  "enabled": false,
  "false_positives": [
    "Approved maintenance or controlled laboratory activity can resemble dangerous command sequence."
  ],
  "from": "now-6m",
  "index": [
    "logs-endpoint.events.process-*",
    "logs-windows.sysmon_operational-*",
    "winlogbeat-*"
  ],
  "interval": "5m",
  "language": "eql",
  "license": "Apache-2.0",
  "max_signals": 100,
  "name": "Dangerous command sequence",
  "note": "## Expected alert\n\nOne medium-severity alert for Dangerous command sequence, preserving the fields declared by this rule.\n\n## Investigation\n\n1. Confirm the originating AI task, human owner and relevant policy version.\n2. Inspect the source event, process ancestry and affected resource evidence.\n3. Validate approvals and determine whether the observed action was authorized.\n4. Preserve timestamps and stable correlation identifiers before containment.\n\n## Limitations\n\n- The sequence is intentionally narrow and can match legitimate automation; it is not an intent verdict.\n- Confirm AI intent, approval, and task scope with the correlated WatchMyAI session evidence.",
  "query": "sequence by process.parent.entity_id with maxspan=5m\n  [process where event.type == \"start\" and process.name in (\"whoami\", \"id\")]\n  [process where event.type == \"start\" and process.name in (\"curl\", \"wget\")]\n  [process where event.type == \"start\" and process.name in (\"sh\", \"bash\", \"powershell.exe\", \"pwsh.exe\")]",
  "references": [
    "docs/WatchMyAI_Detection_Engineering_Handbook.docx#WMAI-052",
    "https://www.elastic.co/docs/reference/ecs"
  ],
  "risk_score": 47,
  "rule_id": "WMAI-052",
  "rule_source": {
    "type": "internal"
  },
  "severity": "medium",
  "tags": [
    "WatchMyAI",
    "AI Agent",
    "CLI Agent",
    "Maturity: validated",
    "Custom telemetry: false",
    "Endpoint building block"
  ],
  "to": "now",
  "type": "eql",
  "version": 1
}
